{
  "schemaVersion": "0.1.0",
  "keyLight": {
    "x": -0.34,
    "y": -0.94
  },
  "sampleStep": 0.25,
  "parts": {
    "commandBody": {
      "size": {
        "width": 96,
        "height": 48
      },
      "highlight": {
        "point": {
          "x": 19.641694962978363,
          "y": 2.8712013512849808
        },
        "response": 0.4523891564895549
      },
      "shading": {
        "point": {
          "x": 76.35830503702164,
          "y": 45.12879864871502
        },
        "response": -0.4523891564895549
      }
    },
    "toggleTrack": {
      "size": {
        "width": 64.5,
        "height": 40.5
      },
      "highlight": {
        "point": {
          "x": 47.68641611933708,
          "y": 38.36273768544197
        },
        "response": 0.4567221308614727
      },
      "shading": {
        "point": {
          "x": 16.813583880662918,
          "y": 2.137262314558029
        },
        "response": -0.4567221308614727
      }
    },
    "toggleThumb": {
      "size": {
        "width": 16,
        "height": 16
      },
      "highlight": {
        "point": {
          "x": 6.208011798560619,
          "y": 1.4779102653265
        },
        "response": 0.4305988174819511
      },
      "shading": {
        "point": {
          "x": 9.791988179087639,
          "y": 14.5220897346735
        },
        "response": -0.4305988174819511
      }
    }
  },
  "rows": [
    {
      "theme": "light",
      "materialFamily": "cast",
      "part": "commandBody",
      "variant": "standard",
      "colorRole": "surface.high",
      "body": [
        0.9882352941176471,
        0.984313725490196,
        0.9725490196078431
      ],
      "highlightDeltaE": 0.0004587287772077151,
      "shadingDeltaE": 0.034013074626118744
    },
    {
      "theme": "light",
      "materialFamily": "cast",
      "part": "commandBody",
      "variant": "primary",
      "colorRole": "accent.primary",
      "body": [
        0.07450980392156863,
        0.3568627450980392,
        0.38823529411764707
      ],
      "highlightDeltaE": 0.020808899588597874,
      "shadingDeltaE": 0.013755816593797645
    },
    {
      "theme": "light",
      "materialFamily": "cast",
      "part": "toggleTrack",
      "variant": "track",
      "colorRole": "surface.low",
      "body": [
        0.8901960784313725,
        0.9058823529411765,
        0.8901960784313725
      ],
      "highlightDeltaE": 0.002822272258800996,
      "shadingDeltaE": 0.03195039334524213,
      "checked": false
    },
    {
      "theme": "light",
      "materialFamily": "cast",
      "part": "toggleTrack",
      "variant": "track",
      "colorRole": "selection",
      "body": [
        0.7490196078431373,
        0.8627450980392157,
        0.8470588235294118
      ],
      "highlightDeltaE": 0.004830010205024388,
      "shadingDeltaE": 0.03005051160774112,
      "checked": true
    },
    {
      "theme": "light",
      "materialFamily": "cast",
      "part": "toggleThumb",
      "variant": "thumb",
      "colorRole": "content.secondary",
      "body": [
        0.23529411764705882,
        0.3176470588235294,
        0.3333333333333333
      ],
      "highlightDeltaE": 0.022361036584725803,
      "shadingDeltaE": 0.012301064446903223,
      "checked": false
    },
    {
      "theme": "light",
      "materialFamily": "cast",
      "part": "toggleThumb",
      "variant": "thumb",
      "colorRole": "content.primary",
      "body": [
        0.09411764705882353,
        0.1607843137254902,
        0.17647058823529413
      ],
      "highlightDeltaE": 0.030066635956236078,
      "shadingDeltaE": 0.006838801369544538,
      "checked": true
    },
    {
      "theme": "light",
      "materialFamily": "frost",
      "part": "commandBody",
      "variant": "standard",
      "colorRole": "surface.high",
      "body": [
        0.9882352941176471,
        0.984313725490196,
        0.9725490196078431
      ],
      "highlightDeltaE": 0.0010320994507517305,
      "shadingDeltaE": 0.047703049820431206
    },
    {
      "theme": "light",
      "materialFamily": "frost",
      "part": "commandBody",
      "variant": "primary",
      "colorRole": "accent.primary",
      "body": [
        0.07450980392156863,
        0.3568627450980392,
        0.38823529411764707
      ],
      "highlightDeltaE": 0.04699726760926651,
      "shadingDeltaE": 0.019288918556078217
    },
    {
      "theme": "light",
      "materialFamily": "frost",
      "part": "toggleTrack",
      "variant": "track",
      "colorRole": "surface.low",
      "body": [
        0.8901960784313725,
        0.9058823529411765,
        0.8901960784313725
      ],
      "highlightDeltaE": 0.00634722124935957,
      "shadingDeltaE": 0.04481054014193893,
      "checked": false
    },
    {
      "theme": "light",
      "materialFamily": "frost",
      "part": "toggleTrack",
      "variant": "track",
      "colorRole": "selection",
      "body": [
        0.7490196078431373,
        0.8627450980392157,
        0.8470588235294118
      ],
      "highlightDeltaE": 0.010866268614862921,
      "shadingDeltaE": 0.04214560481998145,
      "checked": true
    },
    {
      "theme": "light",
      "materialFamily": "frost",
      "part": "toggleThumb",
      "variant": "thumb",
      "colorRole": "content.secondary",
      "body": [
        0.23529411764705882,
        0.3176470588235294,
        0.3333333333333333
      ],
      "highlightDeltaE": 0.04997677644654838,
      "shadingDeltaE": 0.017247382794136165,
      "checked": false
    },
    {
      "theme": "light",
      "materialFamily": "frost",
      "part": "toggleThumb",
      "variant": "thumb",
      "colorRole": "content.primary",
      "body": [
        0.09411764705882353,
        0.1607843137254902,
        0.17647058823529413
      ],
      "highlightDeltaE": 0.06679185967703398,
      "shadingDeltaE": 0.009586597414922089,
      "checked": true
    },
    {
      "theme": "light",
      "materialFamily": "elastomer",
      "part": "commandBody",
      "variant": "standard",
      "colorRole": "surface.high",
      "body": [
        0.9882352941176471,
        0.984313725490196,
        0.9725490196078431
      ],
      "highlightDeltaE": 0.0008027565570217994,
      "shadingDeltaE": 0.08561174012471495
    },
    {
      "theme": "light",
      "materialFamily": "elastomer",
      "part": "commandBody",
      "variant": "primary",
      "colorRole": "accent.primary",
      "body": [
        0.07450980392156863,
        0.3568627450980392,
        0.38823529411764707
      ],
      "highlightDeltaE": 0.03650134122889297,
      "shadingDeltaE": 0.03459932512269286
    },
    {
      "theme": "light",
      "materialFamily": "elastomer",
      "part": "toggleTrack",
      "variant": "track",
      "colorRole": "surface.low",
      "body": [
        0.8901960784313725,
        0.9058823529411765,
        0.8901960784313725
      ],
      "highlightDeltaE": 0.004937626233054944,
      "shadingDeltaE": 0.08042259530999771,
      "checked": false
    },
    {
      "theme": "light",
      "materialFamily": "elastomer",
      "part": "toggleTrack",
      "variant": "track",
      "colorRole": "selection",
      "body": [
        0.7490196078431373,
        0.8627450980392157,
        0.8470588235294118
      ],
      "highlightDeltaE": 0.008451942513108853,
      "shadingDeltaE": 0.07563798386807781,
      "checked": true
    },
    {
      "theme": "light",
      "materialFamily": "elastomer",
      "part": "toggleThumb",
      "variant": "thumb",
      "colorRole": "content.secondary",
      "body": [
        0.23529411764705882,
        0.3176470588235294,
        0.3333333333333333
      ],
      "highlightDeltaE": 0.038973920010256874,
      "shadingDeltaE": 0.03092900724762533,
      "checked": false
    },
    {
      "theme": "light",
      "materialFamily": "elastomer",
      "part": "toggleThumb",
      "variant": "thumb",
      "colorRole": "content.primary",
      "body": [
        0.09411764705882353,
        0.1607843137254902,
        0.17647058823529413
      ],
      "highlightDeltaE": 0.05221027820944423,
      "shadingDeltaE": 0.017180375548546168,
      "checked": true
    },
    {
      "theme": "dark",
      "materialFamily": "cast",
      "part": "commandBody",
      "variant": "standard",
      "colorRole": "surface.high",
      "body": [
        0.15294117647058825,
        0.22745098039215686,
        0.2549019607843137
      ],
      "highlightDeltaE": 0.02772800334193773,
      "shadingDeltaE": 0.00976677491429886
    },
    {
      "theme": "dark",
      "materialFamily": "cast",
      "part": "commandBody",
      "variant": "primary",
      "colorRole": "accent.primary",
      "body": [
        0.4823529411764706,
        0.8274509803921568,
        0.8509803921568627
      ],
      "highlightDeltaE": 0.006753899321094213,
      "shadingDeltaE": 0.027803300252427138
    },
    {
      "theme": "dark",
      "materialFamily": "cast",
      "part": "toggleTrack",
      "variant": "track",
      "colorRole": "surface.low",
      "body": [
        0.050980392156862744,
        0.09411764705882353,
        0.11764705882352941
      ],
      "highlightDeltaE": 0.036469105274635746,
      "shadingDeltaE": 0.004638775603003378,
      "checked": false
    },
    {
      "theme": "dark",
      "materialFamily": "cast",
      "part": "toggleTrack",
      "variant": "track",
      "colorRole": "selection",
      "body": [
        0.17647058823529413,
        0.34901960784313724,
        0.3764705882352941
      ],
      "highlightDeltaE": 0.0222728810693684,
      "shadingDeltaE": 0.013804626131305434,
      "checked": true
    },
    {
      "theme": "dark",
      "materialFamily": "cast",
      "part": "toggleThumb",
      "variant": "thumb",
      "colorRole": "content.secondary",
      "body": [
        0.796078431372549,
        0.8549019607843137,
        0.8431372549019608
      ],
      "highlightDeltaE": 0.004360683268923892,